{"benchmark_version":"0.1.0","claims":{"L0":0,"L1":0,"L2":0},"completeness":{"attempted_case_count":0,"complete":false,"expected_case_count":20,"missing_case_ids":["rk-v0.1-001","rk-v0.1-002","rk-v0.1-003","rk-v0.1-004","rk-v0.1-005","rk-v0.1-006","rk-v0.1-007","rk-v0.1-008","rk-v0.1-009","rk-v0.1-010","rk-v0.1-011","rk-v0.1-012","rk-v0.1-013","rk-v0.1-014","rk-v0.1-015","rk-v0.1-016","rk-v0.1-017","rk-v0.1-018","rk-v0.1-019","rk-v0.1-020"],"missing_cost_attempt_ids":[],"missing_model_cost_call_ids":[],"open_attempt_ids":[],"pending_infrastructure_case_ids":[],"result_case_count":0,"result_only_case_ids":[],"smoke_event_count_excluded":0,"status":"preregistered_no_results","terminal_case_count":0,"terminal_only_case_ids":[],"unmatched_model_call_ids":[]},"cost":{"attempted_case_count":0,"attributable_total_microusd":0,"by_attribution_microusd":{"cold_prep_excluded":0,"human_labor_excluded":0,"scored":0},"by_category_microusd":{"artifact_transfer":0,"dependency_prep":0,"human_review":0,"model_inference":0,"paid_storage":0,"sandbox_compute":0},"cost_per_attempted_case_microusd":null,"cost_per_semantic_valid_microusd":null,"currency":"USD","entry_count":0,"estimated_entry_count":0,"fully_measured":false,"gate":{"not_evaluable_reasons":["benchmark_incomplete","cost_not_fully_measured","zero_semantic_valid_successes"],"operator":"<=","status":"not_evaluable","threshold":1000000},"ratio_rounding":"nearest_microusd_half_up","recorded_amount_total_microusd":0,"status_counts":{"estimated":0,"measured":0,"unknown":0,"zero_verified":0},"unit":"microUSD","unknown_entry_count":0},"inputs":{"ledgers":{"scored":{"bytes":0,"event_count":0,"head_event_sha256":null,"sha256":"e3b0c44298fc1c149afbf4c8996fb92427ae41e4649b934ca495991b7852b855"},"smoke":{"bytes":0,"event_count":0,"head_event_sha256":null,"sha256":"e3b0c44298fc1c149afbf4c8996fb92427ae41e4649b934ca495991b7852b855"}},"manifest":{"bytes":16138,"sha256":"f3e15d05f29269c6d1d067ea7327b63e9b40fcb1ef142c731a215a02b5ebbc8f"},"results":{"bytes":0,"row_count":0,"sha256":"e3b0c44298fc1c149afbf4c8996fb92427ae41e4649b934ca495991b7852b855"}},"outcomes":{"attempt_finished_counts":{"benchmark_infrastructure_error":0,"collect_failure":0,"fail_on_fix":0,"flaky_base":0,"flaky_fix":0,"invalid_patch":0,"no_output":0,"pass_on_base":0,"plausible_f2p_semantic_invalid":0,"policy_violation":0,"semantic_valid":0,"setup_failure":0,"wrong_failure":0},"case_terminal_counts":{"benchmark_infrastructure_error":0,"collect_failure":0,"fail_on_fix":0,"flaky_base":0,"flaky_fix":0,"invalid_patch":0,"no_output":0,"pass_on_base":0,"plausible_f2p_semantic_invalid":0,"policy_violation":0,"semantic_valid":0,"setup_failure":0,"wrong_failure":0}},"primary_metric":{"confidence_interval_95_exact":null,"denominator":20,"gate":{"not_evaluable_reasons":["benchmark_incomplete"],"operator":">=","status":"not_evaluable","threshold":6},"id":"semantic_valid_success_at_1","numerator":0,"rate":null},"quality":{"plausible_f2p_count":0,"semantic_false_reproduction_count":0,"semantic_false_reproduction_denominator":0,"semantic_false_reproduction_rate":null,"semantic_valid_count":0},"runtime":{"excluded_phases":["dependency_prep","semantic_review","gold_unblind"],"gate":{"not_evaluable_reasons":["benchmark_incomplete","unknown_case_runtime"],"operator":"<","status":"not_evaluable","threshold":600000},"included_phases":["preflight","issue_snapshot","generation","candidate_policy","collection","base_verify","fixed_verify","causal_controls"],"known_case_count":0,"p50_ms":null,"p90_ms":null,"percentile_method":"linear_interpolation_r7","scope":"all_scored_attempts_warm_machine_phases","total_observed_ms":0,"unknown_case_count":20,"unknown_case_ids":["rk-v0.1-001","rk-v0.1-002","rk-v0.1-003","rk-v0.1-004","rk-v0.1-005","rk-v0.1-006","rk-v0.1-007","rk-v0.1-008","rk-v0.1-009","rk-v0.1-010","rk-v0.1-011","rk-v0.1-012","rk-v0.1-013","rk-v0.1-014","rk-v0.1-015","rk-v0.1-016","rk-v0.1-017","rk-v0.1-018","rk-v0.1-019","rk-v0.1-020"]},"schema_version":"1.0.0","usage":{"estimated_call_count":0,"model_call_finished_count":0,"model_call_started_count":0,"status_counts":{"estimated":0,"not_applicable":0,"reported":0,"unknown":0},"tokens":{"cached_input_tokens":0,"input_tokens":0,"output_tokens":0,"total_tokens":0},"unknown_call_count":0}}
